video: https://www.youtube.com/watch?v=sRBsJNdK1t0 ,1 ,With all these Liberals hating on Trump he still managed to stay in office for a whole year. Good job Trump.0 ,7 more yrs to go0 ,1 year down 7 more to go!0 ,There were so many connected Russians in the smallish audience that to them it felt like being back in Moscow.1 ,Hard to believe this was a year ago!! 7 more to go #Trump2020 MAGA0 ,My math teacher made us watch this.1 ,People still haven't understood the meaning of Trump. Trump is monumental. This american carniege stops now.-1 ,To quote George W. Bush: Thats some weird shit.1 ,I was there 1 year ago today. The greatest experience of my life1 ,Wish I could of been there.0 ,https://trumpgasm.wordpress.com/2015/12/15/globalism-part-1-donald-trump-an-american-president/
